{
  "protocolVersion": 3,
  "contributorId": "opaque-random-id",
  "period": "2026-09",
  "revision": 5,
  "contribution": {
    "schemaVersion": 3,
    "dimensions": { "countryCode": "ES", "regionCode": "ES-CN", "sex": "FEMALE", "ageBand": "25_34" },
    "financial": { "currencies": [{ "currency": "EUR", "buckets": [{ "source": "SCHEDULED", "kind": "EXPENSE", "amount": "12", "count": 1 }] }] },
    "categories": { "currencies": [{ "currency": "EUR", "buckets": [{ "source": "SCHEDULED", "kind": "EXPENSE", "category": "BILLS", "amount": "12" }] }] },
    "recurring": { "currencies": [{ "currency": "EUR", "buckets": [{ "source": "SCHEDULED", "kind": "EXPENSE", "amount": "12", "occurrenceCount": 1, "seriesCount": 1 }] }] }
  }
}
